{
  "schema_version": "career.resume_analysis_suggestion_review.v1",
  "policy_version": "resume_analysis_suggestion_review_v1",
  "analysis_policy_version": "resume_analysis_v1",
  "core_version": "0.2.0",
  "authority": "assisted_non_authoritative",
  "baseline_analysis": {
    "schema_version": "career.resume_analysis.v1",
    "policy_version": "resume_analysis_v1",
    "reference_policy_version": "deterministic_v2",
    "normalization_policy_version": "resume_normalization_v1",
    "core_version": "0.2.0",
    "document_id": "synthetic-phase7-analysis-suggestions-v1",
    "scoring_weights": {
      "format_ats": 20,
      "content_strength": 25,
      "experience_impact": 20,
      "skills_coverage": 15,
      "presentation": 10,
      "completeness": 10
    },
    "overall_score": 94,
    "category_scores": {
      "format_ats": 100,
      "content_strength": 100,
      "experience_impact": 83,
      "skills_coverage": 90,
      "presentation": 93,
      "completeness": 100
    },
    "summary": "Deterministic analysis completed with an overall score of 94. Strongest category: format_ats. Weakest category: experience_impact.",
    "checks": [
      {
        "check_id": "contact_email_present",
        "category": "completeness",
        "raw_score": 100,
        "score": 100,
        "score_adjusted": false,
        "passed": true,
        "outcome": "passed",
        "detection_status": null,
        "explanation": "Email detected.",
        "evidence": [
          {
            "evidence_id": "resume.analysis.contact_email_present.normalized_field",
            "kind": "normalized_field",
            "source": {
              "start_line": 2,
              "end_line": 2,
              "excerpt": "morgan.lee@example.com",
              "transformation": "verbatim"
            },
            "value": "email_present=true"
          }
        ]
      },
      {
        "check_id": "contact_name_present",
        "category": "completeness",
        "raw_score": 100,
        "score": 100,
        "score_adjusted": false,
        "passed": true,
        "outcome": "passed",
        "detection_status": null,
        "explanation": "Candidate name detected.",
        "evidence": [
          {
            "evidence_id": "resume.analysis.contact_name_present.normalized_field",
            "kind": "normalized_field",
            "source": {
              "start_line": 1,
              "end_line": 1,
              "excerpt": "Morgan Lee",
              "transformation": "verbatim"
            },
            "value": "name_present=true"
          }
        ]
      },
      {
        "check_id": "contact_phone_or_link_present",
        "category": "completeness",
        "raw_score": 100,
        "score": 100,
        "score_adjusted": false,
        "passed": true,
        "outcome": "passed",
        "detection_status": null,
        "explanation": "Phone number or profile link detected.",
        "evidence": [
          {
            "evidence_id": "resume.analysis.contact_phone_or_link_present.normalized_field",
            "kind": "normalized_field",
            "source": {
              "start_line": 3,
              "end_line": 3,
              "excerpt": "+1 555 010 0200",
              "transformation": "verbatim"
            },
            "value": "phone_present=true; link_count=1"
          }
        ]
      },
      {
        "check_id": "summary_present",
        "category": "content_strength",
        "raw_score": 100,
        "score": 100,
        "score_adjusted": false,
        "passed": true,
        "outcome": "passed",
        "detection_status": "detected",
        "explanation": "Summary section detected.",
        "evidence": [
          {
            "evidence_id": "resume.analysis.summary_present.normalized_field",
            "kind": "normalized_field",
            "source": {
              "start_line": 6,
              "end_line": 6,
              "excerpt": "Backend engineer building reliable local services.",
              "transformation": "whitespace_joined"
            },
            "value": "summary_present=true"
          },
          {
            "evidence_id": "resume.analysis.summary_present.field_status",
            "kind": "field_status",
            "source": null,
            "value": "field=summary; status=detected"
          }
        ]
      },
      {
        "check_id": "experience_section_present",
        "category": "completeness",
        "raw_score": 100,
        "score": 100,
        "score_adjusted": false,
        "passed": true,
        "outcome": "passed",
        "detection_status": "detected",
        "explanation": "Experience section detected.",
        "evidence": [
          {
            "evidence_id": "resume.analysis.experience_section_present.normalized_field",
            "kind": "normalized_field",
            "source": {
              "start_line": 8,
              "end_line": 11,
              "excerpt": "Platform Engineer at Acme Corp\n2021 - Present\n- Built reliable APIs for internal teams.\n- Reduced deployment failures by 30 percent.",
              "transformation": "verbatim"
            },
            "value": "experience_entry_count=1"
          },
          {
            "evidence_id": "resume.analysis.experience_section_present.field_status",
            "kind": "field_status",
            "source": null,
            "value": "field=experience; status=detected"
          }
        ]
      },
      {
        "check_id": "education_section_present",
        "category": "completeness",
        "raw_score": 100,
        "score": 100,
        "score_adjusted": false,
        "passed": true,
        "outcome": "passed",
        "detection_status": "detected",
        "explanation": "Education section detected.",
        "evidence": [
          {
            "evidence_id": "resume.analysis.education_section_present.normalized_field",
            "kind": "normalized_field",
            "source": {
              "start_line": 13,
              "end_line": 14,
              "excerpt": "Bachelor of Science in Computer Science, Example University\n2016 - 2020",
              "transformation": "verbatim"
            },
            "value": "education_entry_count=1"
          },
          {
            "evidence_id": "resume.analysis.education_section_present.field_status",
            "kind": "field_status",
            "source": null,
            "value": "field=education; status=detected"
          }
        ]
      },
      {
        "check_id": "skills_section_present",
        "category": "skills_coverage",
        "raw_score": 100,
        "score": 100,
        "score_adjusted": false,
        "passed": true,
        "outcome": "passed",
        "detection_status": "detected",
        "explanation": "Skills section detected.",
        "evidence": [
          {
            "evidence_id": "resume.analysis.skills_section_present.normalized_field",
            "kind": "normalized_field",
            "source": {
              "start_line": 16,
              "end_line": 16,
              "excerpt": "Rust",
              "transformation": "delimiter_split"
            },
            "value": "skill_count=5"
          },
          {
            "evidence_id": "resume.analysis.skills_section_present.field_status",
            "kind": "field_status",
            "source": null,
            "value": "field=skills; status=detected"
          }
        ]
      },
      {
        "check_id": "experience_bullets_present",
        "category": "experience_impact",
        "raw_score": 100,
        "score": 100,
        "score_adjusted": false,
        "passed": true,
        "outcome": "passed",
        "detection_status": null,
        "explanation": "Detected 2 experience bullets.",
        "evidence": [
          {
            "evidence_id": "resume.analysis.experience_bullets_present.metric",
            "kind": "derived_metric",
            "source": {
              "start_line": 10,
              "end_line": 10,
              "excerpt": "Built reliable APIs for internal teams.",
              "transformation": "verbatim"
            },
            "value": "experience_bullet_count=2"
          }
        ]
      },
      {
        "check_id": "experience_bullet_length_quality",
        "category": "experience_impact",
        "raw_score": 100,
        "score": 100,
        "score_adjusted": false,
        "passed": true,
        "outcome": "passed",
        "detection_status": null,
        "explanation": "Checks whether experience bullets are reasonably sized.",
        "evidence": [
          {
            "evidence_id": "resume.analysis.experience_bullet_length_quality.metric",
            "kind": "derived_metric",
            "source": {
              "start_line": 10,
              "end_line": 10,
              "excerpt": "Built reliable APIs for internal teams.",
              "transformation": "verbatim"
            },
            "value": "reasonably_sized_bullets=2/2"
          }
        ]
      },
      {
        "check_id": "experience_date_ranges_present",
        "category": "presentation",
        "raw_score": 100,
        "score": 100,
        "score_adjusted": false,
        "passed": true,
        "outcome": "passed",
        "detection_status": null,
        "explanation": "Checks whether experience entries include date ranges.",
        "evidence": [
          {
            "evidence_id": "resume.analysis.experience_date_ranges_present.metric",
            "kind": "derived_metric",
            "source": {
              "start_line": 9,
              "end_line": 9,
              "excerpt": "2021 - Present",
              "transformation": "verbatim"
            },
            "value": "entries_with_date_ranges=1/1"
          }
        ]
      },
      {
        "check_id": "experience_chronology_consistency",
        "category": "presentation",
        "raw_score": 100,
        "score": 100,
        "score_adjusted": false,